{
  "schema_version": 1,
  "issue_date": "2026-10-27",
  "knowledge_snapshot_id": "knowledge-f2332e024c88d48c",
  "status": "complete",
  "topic_changes": [
    {
      "topic_id": "accelerator_io_datapath",
      "topic_name": "加速器直连I/O与存储数据路径",
      "change_kind": "no_material_change",
      "origin": "applied_task",
      "task_id": "knowledge_addd2fafca32141c101e2ccf",
      "roadmap_version": 1,
      "what_changed": "本期新增了已发布证据，但没有改变当前外部技术判断。",
      "evidence_state": "evidence_building",
      "affected_branches": [],
      "evidence_item_ids": [
        "7185271b4bf979dfc1fcc43c",
        "ada8f3547af65d6b8dfc29be",
        "f22e0fdf7a5a4d877a23ca9b",
        "fcc0c18d8d6e0695d8d52b2d"
      ],
      "current_judgement": "加速器I/O数据路径本期主线是控制路径出内核：uGDS把NVMe命令生命周期移入用户空间、数据经P2P DMA直传显存，内核驱动仅做一次性特权初始化，A100上4KiB同步写时延较GDS再低84.1%、LMCache命中时TTFT降62.7%、并发256下KV吞吐50.2对约19 kTokens/s（每句柄仅支持一块本地NVMe，错误恢复与隔离证据薄弱，12.12倍批量增益含GDS首批惩罚，尚属原型）；三星OCP 2026的AiSIO把GPU发起、P2P与CPU发起I/O收敛到统一API，100M IOPS与10倍冷启动为无基线的厂商声称；HotStorage 2026的一亿IOPS海报仅见于会议程序页、arXiv 2610.06622仅抓到题录，机制与结果均不可见。当前判断：GPU发起I/O正从数据面直达推进到控制面出内核，uGDS可试点用于KV缓存或向量检索外置、先评估错误恢复语义并补齐POSIX适配；厂商数字在给出可复现条件前不作为架构决策依据。"
    },
    {
      "topic_id": "agent_acceleration",
      "topic_name": "Agent语义加速",
      "change_kind": "no_material_change",
      "origin": "applied_task",
      "task_id": "knowledge_cce02a982973d66e57e1bbaa",
      "roadmap_version": 2,
      "what_changed": "本期新增了已发布证据，但没有改变当前外部技术判断。",
      "evidence_state": "evidence_building",
      "affected_branches": [],
      "evidence_item_ids": [
        "0f8f0782f43e62451d8d7661",
        "169359f8c50fb8c845c18ce0",
        "351c7f6d00a6e5ce7d777960",
        "b0a90c9277ec0898cbdeec8e"
      ],
      "current_judgement": "Agent加速本期四条核心证据同属确定性护栏下的复用与拦截：HarnessMM把已定工具决策存为可执行决策图、回执后直接激活执行而不再回调推理，HumanEval上DeepSeek成功率71.43%升至85.71%且token降87.93%、Codex成功率持平而token仅降29.54%——弱模型获益更大（消融中禁用决策图执行多解4题，仅覆盖短编码任务）；StateMirror在执行前从命令、工具参数和AST提取谓词做只读探测，拦截引用缺失模块或路径的幻觉调用，F1为0.817且干预比报告模式省15.8%时间、解决数不变（仅静态可检查错误）；TomasuLLM用写时复制沙箱乱序执行预测动作、按轨迹序提交验证，提速1.27至1.35倍且4010条提交零误收（换取单会话时延而非吞吐，亚秒级调用不划算）；SPECMEM以按用户在线更新的调用记忆做投机草稿，解码加速最高1.74倍、副作用门控把错误不可逆执行降为零，但预热覆盖全部任务时增益缩至约2%——静态缓存随任务漂移失效。当前判断：与上期一致且更强，省的是可预知的工作、成立靠不耗推理的确定性护栏，在线写回与回退路径是复用机制标配；结构化原语的收益按模型能力分层。"
    },
    {
      "topic_id": "ai_chip_accelerator",
      "topic_name": "AI芯片与加速器",
      "change_kind": "no_material_change",
      "origin": "applied_task",
      "task_id": "knowledge_6b8e0cac24c2ebbcbf7cfc45",
      "roadmap_version": 2,
      "what_changed": "本期新增了已发布证据，但没有改变当前外部技术判断。",
      "evidence_state": "evidence_building",
      "affected_branches": [],
      "evidence_item_ids": [
        "205c28f116281ec06ffdb6ac",
        "7135a64400c9d38f2c5b28cb",
        "c2446ffe35cd7c1110ea257f",
        "cd7146987792b8c9659d058e"
      ],
      "current_judgement": "AI芯片本期证据延续可用算力由软件栈与格式选择决定的判断并落到算子与接口层：MoESQ联合训练4:8稀疏支撑与NVFP4量化并配原生稀疏GEMM内核，单卡B200内核较稠密NVFP4提速1.11至1.76倍、Kimi-K2.5精度保留96.09%（4.03倍端到端对比的是较慢INT4基线，能耗与吞吐分属B300和B200）；CompactInst以屋顶线加DRAM计数器实测证明查询式分割解码器在边缘GPU受跨内核激活流量而非FLOPs限制，4×token池化削减64%解码器DRAM字节（DRAM字节仅A4000实测）；SyclKittens把Intel GPU架构经验编成tile接口，同一编码智能体的单卡GEMM从oneDNN的57.5%提到82.1%、工程师协作后27形状达约96%；华为CANNBot-CAKE把算子请求自动化为可部署CANN自定义算子，53个标准集算子100%通过、平均加速1.334倍（对比基线未见定义）。当前判断：接口与算子生态决定算力兑现，评估加速器引用内核峰值时必须核对基线、调优条件与实测带宽。"
    },
    {
      "topic_id": "ai_infra_horizontal",
      "topic_name": "AI Infra横向动态",
      "change_kind": "no_material_change",
      "origin": "applied_task",
      "task_id": "knowledge_46e503035f4ac3b42d1658de",
      "roadmap_version": 1,
      "what_changed": "本期新增了已发布证据，但没有改变当前外部技术判断。",
      "evidence_state": "evidence_building",
      "affected_branches": [],
      "evidence_item_ids": [
        "3b4ec69da9e2508829f66968",
        "d0a71d37f14bb457e1c88b46"
      ],
      "current_judgement": "AI Infra横向动态本期两条核心证据都在推理服务与运行时：MacPaw用统一单请求解码负载在四台Apple机型配RTX 4090对照逐项复测四类服务器GPU上验证的优化，KV剪枝吞吐在Apple上最高1.75倍而RTX 4090至多1.02倍、六种投机解码方法主基准全部负收益、唯一解码提升1.1%的例外端到端反降13.8%，端侧选型不能照搬服务器结论（限于单请求本地解码，未评估多请求批处理）；TRE以跨模型可比的令牌服务份额统一驱动共享GPU池的副本调配、按10秒周期向缺口最大模型小步迁移并保持副本秒级睡眠唤醒，较KV缓存反应式扩缩器把P95端到端时延降11.9%至79.0%（仅2节点8卡测试台，未报告生产部署与吞吐影响）。当前判断：端侧选型应按目标机型实测并复用其HW-GAP类标签预判可移植性；多模型混部容量调度可跟踪其跨模型信号与热切换设计，引用时标注测试台预印本。"
    },
    {
      "topic_id": "cross_region",
      "topic_name": "跨域传输",
      "change_kind": "no_material_change",
      "origin": "applied_task",
      "task_id": "knowledge_842e42a60a70f08bcfdf33d8",
      "roadmap_version": 1,
      "what_changed": "本期新增了已发布证据，但没有改变当前外部技术判断。",
      "evidence_state": "evidence_building",
      "affected_branches": [],
      "evidence_item_ids": [
        "3c3e86051292597ca10a411b",
        "98dad7f3b86b8ffa68abb37d",
        "d571ce30e203570a27a3df60",
        "e1332ce77a7972a82983eea5"
      ],
      "current_judgement": "跨域传输本期证据从KV体积杠杆转向Agent状态与潜层通信：J-Comm把发送方潜层推理编码为定长消息、接收方在自身词表与宽度下重建，KV缓存各留本地即实现异构模型复用中间计算，七项基准全部高于文本转述基线1.29至8.59个百分点、生成token减19.2%至74.8%（只报准确率与token数，无字节、带宽与时延数据）；CARE用轻量批评者按置信度在本地与云端间切换控制权，共享交接记忆只存已验证状态，去掉后恢复成功率从100%降至25%（全部仿真基准）；RIFT揭示草稿KV压缩的解码陈旧性——prefill式一次选择随生成推进失效，滑窗加周期重打分把接受长度从4.07提到6.19；记忆价值框架给出避免的任务损失口径，3.8KB账本加4KB有界检索F1为0.329胜97KB完整历史的0.123。当前判断：跨域复用最该优先传输已验证进展与潜层摘要而非原始轨迹或全量KV，有界状态常优于全量历史；但本期四条均无WAN成本数据，传输体积收益不能据此外推。"
    },
    {
      "topic_id": "kv_management",
      "topic_name": "KVCache管理与复用",
      "change_kind": "no_material_change",
      "origin": "applied_task",
      "task_id": "knowledge_33587d77df2d53483ef94a81",
      "roadmap_version": 1,
      "what_changed": "本期新增了已发布证据，但没有改变当前外部技术判断。",
      "evidence_state": "evidence_building",
      "affected_branches": [],
      "evidence_item_ids": [
        "03ef64972818234359298513",
        "6781d10382738565515010ba",
        "dfdc97891d87a34b6d9b4a17",
        "e4713bb91707e4da8632575b"
      ],
      "current_judgement": "KVCache管理本期证据从细粒度化转向默认化与正确性：vLLM v0.32.0把FP8等低精度KVCache按架构设为默认，SM100上每rank KV显存减半、吞吐增2.3至5.5%但TTFT增7至11%（数字全部来自PR基准且无方法学，58%的HiSparse增益未说明基线）；Vosti用Verus形式化证明调度与分页前缀共享KVCache保持输出比特级一致，七个模型5488次logit比对全部一致、H200解码吞吐为vLLM不变模式的1.36至3.19倍（只证明确定性而非功能正确性，仅单GPU）；Universal Attention以可训练衰减门做逐token自剪枝，约7至21倍缓存缩减换不到1分损失但属架构级方案；S3R用KV感知调度把RL rollout中GPU与CPU间重复搬运页从5.362M降到0.144M。当前判断：低精度KV是升级即得的显存换时延杠杆、Vosti的页级不变式与精确前缀校验应作为改分页或驱逐逻辑的回归门，两者立即可用；架构级自剪枝不能用于存量服务，AIMD式KV感知调度可迁移到rollout引擎；实际收益需自测命中率与端到端指标。"
    },
    {
      "topic_id": "tpn",
      "topic_name": "状态感知网络、TPN",
      "change_kind": "no_material_change",
      "origin": "applied_task",
      "task_id": "knowledge_595c76283f161479a6cb819f",
      "roadmap_version": 2,
      "what_changed": "本期新增了已发布证据，但没有改变当前外部技术判断。",
      "evidence_state": "evidence_building",
      "affected_branches": [],
      "evidence_item_ids": [
        "4b5ef51f782ab2b0cd6102cd",
        "5a66740e74019b21af6ba874",
        "c184313e0ada70903e6ca530",
        "d113056eb7031993bac2c113"
      ],
      "current_judgement": "TPN方向本期证据把每次KV交接的固定开销推到中心：InferSlice在英国电信广域网实测单跳WAN的PD解耦，中位TTFT从0.11秒升至4.24秒、P99达19秒且惩罚不随RTT增大，作者归因每请求KV交接的固定开销——先批量化或流水线化交接再谈扩带宽；KVStream把两级存储读取改成完成驱动路由，32B在线平均TTFT从31.1秒降到13.0秒而静态分层对照恶化到122.1秒，证明完成事件而非带宽预测是多路径调度的正确信号（复用集可放进内存时收益消失，2倍写放大）；EdgeFlow按带宽逐层拆分直接传输与激活重算使迁移时间最多降约45%（100Mbps下优势消失）；SARIA在DRAM-SSD分层上叠加GPU入站带宽协调，尾部传输再降11.0%至17.8%（配额须匹配有效路径带宽）。当前判断：跨节点KV放置与带宽调度仍是空位，但节点内与广域证据一致指向调度与交接批量优先于堆带宽；网络侧需联合TTFT与TPOT判别饱和来源，单看利用率不够。"
    }
  ],
  "idea_events": [
    {
      "idea_id": "idea_0beeab7573d3f58b0330",
      "title": "把硬件知识与真实部署验收接成内核优化闭环",
      "decision": "evidence_added",
      "from_status": "observing",
      "to_status": "observing",
      "reason": "新增NPU算子闭环生成与设备良法接口两条证据，状态保持observing，仍缺可用内核比例与模型级收益的直接度量。",
      "evidence_item_ids": [
        "205c28f116281ec06ffdb6ac",
        "c2446ffe35cd7c1110ea257f"
      ]
    },
    {
      "idea_id": "idea_6e6886675f61e74dd472",
      "title": "工具接口要按 Agent 能力分层，而不是统一追求更复杂",
      "decision": "evidence_added",
      "from_status": "seed",
      "to_status": "seed",
      "reason": "新增结构化原语收益按模型能力分层的配对实测，seed状态首次获得直接证据但仍单点，维持seed。",
      "evidence_item_ids": [
        "169359f8c50fb8c845c18ce0"
      ]
    },
    {
      "idea_id": "idea_7d4c5b213d117cba4697",
      "title": "跨模型 KV 迁移需要把映射误差与刷新频率一起调度",
      "decision": "evidence_added",
      "from_status": "observing",
      "to_status": "observing",
      "reason": "新增异构模型潜层消息复用的对照实证，状态保持observing，迁移成本与周期性刷新的联合建模仍缺数据。",
      "evidence_item_ids": [
        "d571ce30e203570a27a3df60"
      ]
    },
    {
      "idea_id": "idea_a90d71c35ea8a0f208da",
      "title": "在工具调用前加入状态与资源监督层",
      "decision": "evidence_added",
      "from_status": "observing",
      "to_status": "observing",
      "reason": "新增分派前只读探测与不可逆副作用门控两条证据，状态保持observing，资源契约检查与中止原语的完整设计仍待验证。",
      "evidence_item_ids": [
        "0f8f0782f43e62451d8d7661",
        "b0a90c9277ec0898cbdeec8e"
      ]
    },
    {
      "idea_id": "idea_caedb2a55c74292cb409",
      "title": "用版本化冲突保留实现可审计的分布式 Agent 记忆合并",
      "decision": "evidence_added",
      "from_status": "observing",
      "to_status": "observing",
      "reason": "新增已验证状态优先共享的消融证据，状态保持observing，版本化冲突合并本身仍无直接实测。",
      "evidence_item_ids": [
        "e1332ce77a7972a82983eea5"
      ]
    },
    {
      "idea_id": "idea_f7841984fcce6a274881",
      "title": "KV 传输、重算与就地计算存在随带宽和命中率变化的交叉点",
      "decision": "evidence_added",
      "from_status": "observing",
      "to_status": "observing",
      "reason": "新增带宽感知传输-重算拆分与广域PD交接固定开销两条实测，状态保持observing，仍缺传输、重算与就地Prefill三策略在统一负载下的完整对照。",
      "evidence_item_ids": [
        "c184313e0ada70903e6ca530",
        "d113056eb7031993bac2c113"
      ]
    }
  ]
}